{
  "apiVersion": "agentic-framework.github.com/v1alpha1",
  "kind": "CapabilityRegistry",
  "metadata": { "version": "1.0.0" },
  "defaults": {
    "tools": "deny",
    "network": "deny",
    "writes": "deny",
    "secrets": "deny"
  },
  "capabilities": [
    {
      "id": "core.frame-artifact",
      "version": "1.0.0",
      "publisher": "agentic-framework",
      "owner": "framework-maintainers",
      "description": "Produces a target-free framing artifact for deterministic validation.",
      "status": "active",
      "implementation": { "kind": "model", "provider": "configured-provider" },
      "allowedPhases": ["framing"],
      "actorClasses": ["system"],
      "inputSchema": {
        "type": "object",
        "additionalProperties": false,
        "required": ["evidence"],
        "properties": { "evidence": { "type": "array", "items": { "type": "string" } } }
      },
      "outputSchema": {
        "type": "object",
        "additionalProperties": false,
        "required": ["summary", "openQuestions"],
        "properties": {
          "summary": { "type": "string", "maxLength": 8000 },
          "openQuestions": { "type": "array", "items": { "type": "string" }, "maxItems": 20 }
        }
      },
      "access": {
        "readScopes": ["accord-evidence"],
        "write": { "allowed": false, "scopes": [] },
        "tools": [],
        "shellCommands": [],
        "networkDestinations": [],
        "mcpTools": ["github.issue_read", "safeoutputs.add_comment"],
        "mcpReadTools": ["github.issue_read"],
        "mcpMutationTools": ["safeoutputs.add_comment"],
        "secretNames": []
      },
      "effectClass": "advisory-artifact",
      "risk": { "class": "moderate", "trustZone": "T3", "privacyClass": "internal" },
      "limits": { "maxCalls": 1, "maxCostUnits": 10, "timeoutMs": 120000, "maxRetries": 1, "maxOutputBytes": 32768, "maxConcurrency": 1, "parallelSafe": false },
      "humanGates": ["activate"],
      "idempotency": { "required": true, "scope": "contract-revision" },
      "evidence": ["validated-output-digest", "provider-model-receipt"],
      "evaluations": { "structural": ["schema-valid", "target-free"], "behavioral": ["framing-rubric-v1"] },
      "provenance": { "classification": "original", "legalReview": "not-required", "securityReview": "pending" },
      "compatibility": { "lifecycle": "1.0.0", "replacement": null }
    },
    {
      "id": "core.verify-evidence",
      "version": "1.0.0",
      "publisher": "agentic-framework",
      "owner": "framework-maintainers",
      "description": "Evaluates supplied evidence without selecting a target, route, or effect.",
      "status": "active",
      "implementation": { "kind": "deterministic", "provider": "local" },
      "allowedPhases": ["verification"],
      "actorClasses": ["system"],
      "inputSchema": {
        "type": "object",
        "additionalProperties": false,
        "required": ["evidenceDigests"],
        "properties": { "evidenceDigests": { "type": "array", "items": { "type": "string" } } }
      },
      "outputSchema": {
        "type": "object",
        "additionalProperties": false,
        "required": ["result", "findings"],
        "properties": {
          "result": { "enum": ["success", "failure"] },
          "findings": { "type": "array", "items": { "type": "string" }, "maxItems": 100 }
        }
      },
      "access": {
        "readScopes": ["verification-evidence"],
        "write": { "allowed": false, "scopes": [] },
        "tools": [],
        "shellCommands": [],
        "networkDestinations": [],
        "mcpTools": [],
        "mcpReadTools": [],
        "mcpMutationTools": [],
        "secretNames": []
      },
      "effectClass": "verification-result",
      "risk": { "class": "low", "trustZone": "T0", "privacyClass": "internal" },
      "limits": { "maxCalls": 1, "maxCostUnits": 0, "timeoutMs": 30000, "maxRetries": 0, "maxOutputBytes": 32768, "maxConcurrency": 1, "parallelSafe": true },
      "humanGates": [],
      "idempotency": { "required": true, "scope": "event" },
      "evidence": ["validated-output-digest"],
      "evaluations": { "structural": ["schema-valid", "target-free"], "behavioral": ["verification-rubric-v1"] },
      "provenance": { "classification": "original", "legalReview": "not-required", "securityReview": "pending" },
      "compatibility": { "lifecycle": "1.0.0", "replacement": null }
    },
    {
      "id": "core.execute-bounded-change",
      "version": "1.0.0",
      "publisher": "agentic-framework",
      "owner": "framework-maintainers",
      "description": "Drafts content for trusted logical target slots without shell, network, MCP, secrets, path selection, or GitHub mutation authority.",
      "status": "active",
      "implementation": { "kind": "model", "provider": "configured-provider" },
      "allowedPhases": ["execution"],
      "actorClasses": ["system"],
      "inputSchema": {
        "type": "object",
        "additionalProperties": false,
        "required": ["evidence", "targetSlots", "maxPatchBytes"],
        "properties": {
          "evidence": { "type": "array", "items": { "type": "string" } },
          "targetSlots": {
            "type": "array",
            "items": { "type": "string", "pattern": "^[a-z][a-z0-9-]{0,62}$" }
          },
          "maxPatchBytes": { "type": "integer", "minimum": 1 }
        }
      },
      "outputSchema": {
        "type": "object",
        "additionalProperties": false,
        "required": ["summary", "changes", "findings", "openQuestions", "result"],
        "properties": {
          "summary": { "type": "string", "maxLength": 8000 },
          "changes": {
            "type": "array",
            "maxItems": 100,
            "items": {
              "type": "object",
              "additionalProperties": false,
              "required": ["slot", "content"],
              "properties": {
                "slot": { "type": "string", "pattern": "^[a-z][a-z0-9-]{0,62}$" },
                "content": { "type": "string", "maxLength": 262144 }
              }
            }
          },
          "findings": { "type": "array", "items": { "type": "string" }, "maxItems": 100 },
          "openQuestions": { "type": "array", "items": { "type": "string" }, "maxItems": 20 },
          "result": { "enum": ["drafted", "blocked", "failed"] }
        }
      },
      "access": {
        "readScopes": ["accord-evidence"],
        "write": { "allowed": false, "scopes": [] },
        "tools": [],
        "shellCommands": [],
        "networkDestinations": [],
        "mcpTools": [],
        "mcpReadTools": [],
        "mcpMutationTools": [],
        "secretNames": []
      },
      "effectClass": "advisory-artifact",
      "risk": { "class": "high", "trustZone": "T3", "privacyClass": "confidential" },
      "limits": { "maxCalls": 1, "maxCostUnits": 20, "timeoutMs": 600000, "maxRetries": 1, "maxOutputBytes": 262144, "maxConcurrency": 1, "parallelSafe": false },
      "humanGates": ["activate", "accept-frame", "accept-plan"],
      "idempotency": { "required": true, "scope": "contract-revision" },
      "evidence": ["validated-output-digest", "provider-model-receipt", "patch-digest"],
      "evaluations": { "structural": ["schema-valid", "path-bounded", "target-free"], "behavioral": ["execution-role-rubric-v1", "authority-refusal-rubric-v1"] },
      "provenance": { "classification": "original", "legalReview": "not-required", "securityReview": "pending" },
      "compatibility": { "lifecycle": "1.0.0", "replacement": null }
    },
    {
      "id": "core.review-current-head",
      "version": "1.0.0",
      "publisher": "agentic-framework",
      "owner": "framework-maintainers",
      "description": "Produces comment-only findings about an exact pull-request head without approval or merge authority.",
      "status": "active",
      "implementation": { "kind": "model", "provider": "configured-provider" },
      "allowedPhases": ["verification"],
      "actorClasses": ["system", "reviewer"],
      "inputSchema": {
        "type": "object",
        "additionalProperties": false,
        "required": ["headSha", "evidence"],
        "properties": {
          "headSha": { "type": "string", "pattern": "^[a-f0-9]{40}$" },
          "evidence": { "type": "array", "items": { "type": "string" } }
        }
      },
      "outputSchema": {
        "type": "object",
        "additionalProperties": false,
        "required": ["summary", "findings", "openQuestions"],
        "properties": {
          "summary": { "type": "string", "maxLength": 8000 },
          "findings": { "type": "array", "items": { "type": "string" }, "maxItems": 100 },
          "openQuestions": { "type": "array", "items": { "type": "string" }, "maxItems": 20 }
        }
      },
      "access": {
        "readScopes": ["authorized-review-evidence", "trusted-review-profile", "trusted-review-skills", "trusted-gh-aw-runtime-control"],
        "write": { "allowed": false, "scopes": [] },
        "tools": ["read", "search"],
        "shellCommands": [],
        "networkDestinations": [],
        "mcpTools": ["safeoutputs.submit_pull_request_review"],
        "mcpReadTools": [],
        "mcpMutationTools": ["safeoutputs.submit_pull_request_review"],
        "secretNames": []
      },
      "effectClass": "verification-result",
      "risk": { "class": "moderate", "trustZone": "T3", "privacyClass": "confidential" },
      "limits": { "maxCalls": 1, "maxCostUnits": 20, "timeoutMs": 600000, "maxRetries": 1, "maxOutputBytes": 65536, "maxConcurrency": 1, "parallelSafe": false },
      "humanGates": ["activate", "approve-current-head"],
      "idempotency": { "required": true, "scope": "event" },
      "evidence": ["validated-output-digest", "provider-model-receipt", "current-head-digest", "threat-detection-success"],